{
  "schema_version": "0.1",
  "packet_type": "LOCALITY_REVIEW_SNAPSHOT",
  "node_id": "DONGJIAKOU-NODE-001",
  "evidence_class": "SIMULATED",
  "publication_status": "PUBLIC_REVIEW_CANDIDATE",
  "authority": "NONE",
  "source_revision": null,
  "source_revision_verified": false,
  "payload_sha256": "87fffbae45d81c732618fd441948fa2c95fe73c2a8fd8df32eff0dd9e88a2084",
  "capabilities": [
    "READ_PUBLIC_EVIDENCE",
    "RUN_OFFLINE_SCENARIOS",
    "EXPORT_REVIEW_PACKET"
  ],
  "actuator_authority": false,
  "provider_calls": 0,
  "model_calls": 0,
  "invariant_namespace": "djk-locality-001",
  "payload": {
    "qol": {
      "schema_version": "0.1",
      "node_id": "DONGJIAKOU-NODE-001",
      "qol_subnode": "QOL01",
      "classification": "RESEARCH_CANDIDATE_NON_CANON",
      "first_class_objective": true,
      "composite_score": null,
      "objective_vector": [
        {
          "indicator_id": "affordable_nutritious_food_access",
          "stratum": "disabled_people",
          "domain": "water_food",
          "claim_dimension": "ACCESS",
          "direction": "HIGHER_BETTER",
          "unit": "percent",
          "change_interval": null,
          "state": "UNKNOWN_MISSING_BASELINE_AND_FOLLOWUP",
          "realized_credit": 0
        },
        {
          "indicator_id": "affordable_nutritious_food_access",
          "stratum": "low_income_households",
          "domain": "water_food",
          "claim_dimension": "ACCESS",
          "direction": "HIGHER_BETTER",
          "unit": "percent",
          "change_interval": null,
          "state": "UNKNOWN_MISSING_BASELINE_AND_FOLLOWUP",
          "realized_credit": 0
        },
        {
          "indicator_id": "affordable_nutritious_food_access",
          "stratum": "migrant_workers",
          "domain": "water_food",
          "claim_dimension": "ACCESS",
          "direction": "HIGHER_BETTER",
          "unit": "percent",
          "change_interval": null,
          "state": "UNKNOWN_MISSING_BASELINE_AND_FOLLOWUP",
          "realized_credit": 0
        },
        {
          "indicator_id": "affordable_nutritious_food_access",
          "stratum": "residents",
          "domain": "water_food",
          "claim_dimension": "ACCESS",
          "direction": "HIGHER_BETTER",
          "unit": "percent",
          "change_interval": null,
          "state": "UNKNOWN_MISSING_BASELINE_AND_FOLLOWUP",
          "realized_credit": 0
        },
        {
          "indicator_id": "affordable_nutritious_food_access",
          "stratum": "shift_workers",
          "domain": "water_food",
          "claim_dimension": "ACCESS",
          "direction": "HIGHER_BETTER",
          "unit": "percent",
          "change_interval": null,
          "state": "UNKNOWN_MISSING_BASELINE_AND_FOLLOWUP",
          "realized_credit": 0
        },
        {
          "indicator_id": "affordable_nutritious_food_access",
          "stratum": "workers",
          "domain": "water_food",
          "claim_dimension": "ACCESS",
          "direction": "HIGHER_BETTER",
          "unit": "percent",
          "change_interval": null,
          "state": "UNKNOWN_MISSING_BASELINE_AND_FOLLOWUP",
          "realized_credit": 0
        },
        {
          "indicator_id": "anxiety",
          "stratum": "disabled_people",
          "domain": "experience",
          "claim_dimension": "SUBJECTIVE_WELLBEING",
          "direction": "LOWER_BETTER",
          "unit": "score_0_10",
          "change_interval": null,
          "state": "UNKNOWN_MISSING_BASELINE_AND_FOLLOWUP",
          "realized_credit": 0
        },
        {
          "indicator_id": "anxiety",
          "stratum": "low_income_households",
          "domain": "experience",
          "claim_dimension": "SUBJECTIVE_WELLBEING",
          "direction": "LOWER_BETTER",
          "unit": "score_0_10",
          "change_interval": null,
          "state": "UNKNOWN_MISSING_BASELINE_AND_FOLLOWUP",
          "realized_credit": 0
        },
        {
          "indicator_id": "anxiety",
          "stratum": "migrant_workers",
          "domain": "experience",
          "claim_dimension": "SUBJECTIVE_WELLBEING",
          "direction": "LOWER_BETTER",
          "unit": "score_0_10",
          "change_interval": null,
          "state": "UNKNOWN_MISSING_BASELINE_AND_FOLLOWUP",
          "realized_credit": 0
        },
        {
          "indicator_id": "anxiety",
          "stratum": "residents",
          "domain": "experience",
          "claim_dimension": "SUBJECTIVE_WELLBEING",
          "direction": "LOWER_BETTER",
          "unit": "score_0_10",
          "change_interval": null,
          "state": "UNKNOWN_MISSING_BASELINE_AND_FOLLOWUP",
          "realized_credit": 0
        },
        {
          "indicator_id": "anxiety",
          "stratum": "shift_workers",
          "domain": "experience",
          "claim_dimension": "SUBJECTIVE_WELLBEING",
          "direction": "LOWER_BETTER",
          "unit": "score_0_10",
          "change_interval": null,
          "state": "UNKNOWN_MISSING_BASELINE_AND_FOLLOWUP",
          "realized_credit": 0
        },
        {
          "indicator_id": "anxiety",
          "stratum": "workers",
          "domain": "experience",
          "claim_dimension": "SUBJECTIVE_WELLBEING",
          "direction": "LOWER_BETTER",
          "unit": "score_0_10",
          "change_interval": null,
          "state": "UNKNOWN_MISSING_BASELINE_AND_FOLLOWUP",
          "realized_credit": 0
        },
        {
          "indicator_id": "cold_chain_compliance",
          "stratum": "disabled_people",
          "domain": "water_food",
          "claim_dimension": "SERVICE_QUALITY",
          "direction": "HIGHER_BETTER",
          "unit": "percent",
          "change_interval": null,
          "state": "UNKNOWN_MISSING_BASELINE_AND_FOLLOWUP",
          "realized_credit": 0
        },
        {
          "indicator_id": "cold_chain_compliance",
          "stratum": "low_income_households",
          "domain": "water_food",
          "claim_dimension": "SERVICE_QUALITY",
          "direction": "HIGHER_BETTER",
          "unit": "percent",
          "change_interval": null,
          "state": "UNKNOWN_MISSING_BASELINE_AND_FOLLOWUP",
          "realized_credit": 0
        },
        {
          "indicator_id": "cold_chain_compliance",
          "stratum": "migrant_workers",
          "domain": "water_food",
          "claim_dimension": "SERVICE_QUALITY",
          "direction": "HIGHER_BETTER",
          "unit": "percent",
          "change_interval": null,
          "state": "UNKNOWN_MISSING_BASELINE_AND_FOLLOWUP",
          "realized_credit": 0
        },
        {
          "indicator_id": "cold_chain_compliance",
          "stratum": "residents",
          "domain": "water_food",
          "claim_dimension": "SERVICE_QUALITY",
          "direction": "HIGHER_BETTER",
          "unit": "percent",
          "change_interval": null,
          "state": "UNKNOWN_MISSING_BASELINE_AND_FOLLOWUP",
          "realized_credit": 0
        },
        {
          "indicator_id": "cold_chain_compliance",
          "stratum": "shift_workers",
          "domain": "water_food",
          "claim_dimension": "SERVICE_QUALITY",
          "direction": "HIGHER_BETTER",
          "unit": "percent",
          "change_interval": null,
          "state": "UNKNOWN_MISSING_BASELINE_AND_FOLLOWUP",
          "realized_credit": 0
        },
        {
          "indicator_id": "cold_chain_compliance",
          "stratum": "workers",
          "domain": "water_food",
          "claim_dimension": "SERVICE_QUALITY",
          "direction": "HIGHER_BETTER",
          "unit": "percent",
          "change_interval": null,
          "state": "UNKNOWN_MISSING_BASELINE_AND_FOLLOWUP",
          "realized_credit": 0
        },
        {
          "indicator_id": "culture_education_access",
          "stratum": "disabled_people",
          "domain": "community",
          "claim_dimension": "ACCESS",
          "direction": "HIGHER_BETTER",
          "unit": "percent",
          "change_interval": null,
          "state": "UNKNOWN_MISSING_BASELINE_AND_FOLLOWUP",
          "realized_credit": 0
        },
        {
          "indicator_id": "culture_education_access",
          "stratum": "low_income_households",
          "domain": "community",
          "claim_dimension": "ACCESS",
          "direction": "HIGHER_BETTER",
          "unit": "percent",
          "change_interval": null,
          "state": "UNKNOWN_MISSING_BASELINE_AND_FOLLOWUP",
          "realized_credit": 0
        },
        {
          "indicator_id": "culture_education_access",
          "stratum": "migrant_workers",
          "domain": "community",
          "claim_dimension": "ACCESS",
          "direction": "HIGHER_BETTER",
          "unit": "percent",
          "change_interval": null,
          "state": "UNKNOWN_MISSING_BASELINE_AND_FOLLOWUP",
          "realized_credit": 0
        },
        {
          "indicator_id": "culture_education_access",
          "stratum": "residents",
          "domain": "community",
          "claim_dimension": "ACCESS",
          "direction": "HIGHER_BETTER",
          "unit": "percent",
          "change_interval": null,
          "state": "UNKNOWN_MISSING_BASELINE_AND_FOLLOWUP",
          "realized_credit": 0
        },
        {
          "indicator_id": "culture_education_access",
          "stratum": "shift_workers",
          "domain": "community",
          "claim_dimension": "ACCESS",
          "direction": "HIGHER_BETTER",
          "unit": "percent",
          "change_interval": null,
          "state": "UNKNOWN_MISSING_BASELINE_AND_FOLLOWUP",
          "realized_credit": 0
        },
        {
          "indicator_id": "culture_education_access",
          "stratum": "workers",
          "domain": "community",
          "claim_dimension": "ACCESS",
          "direction": "HIGHER_BETTER",
          "unit": "percent",